{
  "schema_version": "1.0.0",
  "retrieved_at": "2026-08-23",
  "institution": {
    "name": "中国地质大学（武汉）",
    "term_target": "2026年秋季（2026-2027学年第1学期）"
  },
  "scope": {
    "description": "学校2026年本科招生专业目录中的专业，以及检索确认的特殊培养项目/班型。",
    "current_catalog_major_count_reported": 76,
    "current_catalog_unique_major_records_in_registry": 76,
    "host_college_count": 20,
    "special_unit_count": 3,
    "first_enrollment_2026_majors": [
      "行星科学",
      "空间科学与技术",
      "机器人工程",
      "人工智能",
      "数字经济",
      "智慧城市与空间规划"
    ],
    "registry_entry_count": 97
  },
  "access_levels": {
    "A": {
      "access_mode": "direct",
      "status": "EXACT_VERIFIED",
      "meaning": "官方附件可直接下载且已逐页解析复核；允许培养方案导入。"
    },
    "B": {
      "access_mode": "captcha/upload_required",
      "status": "FOUND_UNPARSED",
      "meaning": "官方附件存在但下载需验证码；仅在用户/管理员上传原件并校验后启用。"
    },
    "C": {
      "access_mode": "auth_required",
      "status": "LOCKED",
      "meaning": "官方页面需身份认证；需有权限者导出上传，取得正文前禁用导入。"
    },
    "D": {
      "access_mode": "not_found/manual_only",
      "status": "MISSING",
      "meaning": "未找到当前完整方案，或只有旧版/新闻/介绍；只允许手动输入。"
    }
  },
  "authoritative_sources": [
    {
      "kind": "current_undergraduate_major_catalog",
      "url": "https://www.cug.edu.cn/xkjs1/bkzysz.htm",
      "published_at": null,
      "evidence": "学校本科招生专业目录列出76个专业，页面标注数据截至2026年4月。"
    },
    {
      "kind": "current_organization_directory",
      "url": "https://www.cug.edu.cn/zzjg1.htm",
      "published_at": null,
      "evidence": "学校现行学院与机构目录，用于学院名称和归属核对。"
    },
    {
      "kind": "2023_plan_revision_notice",
      "url": "https://www.cug.edu.cn/info/10506/102521.htm",
      "published_at": null,
      "evidence": "学校组织70个本科专业开展2023版方案审查；新闻不是方案正文。"
    },
    {
      "kind": "central_plan_index",
      "url": "https://jwc.cug.edu.cn/zyml/bkpyfa_.htm",
      "published_at": null,
      "evidence": "截至检索日未提供覆盖当前专业的集中式2023版方案库。"
    },
    {
      "kind": "new_2026_major_notice",
      "url": "https://www.cug.edu.cn/info/10506/119113.htm",
      "published_at": null,
      "evidence": "学校公告确认六个专业于2026年首次招生。"
    },
    {
      "kind": "2026_fall_course_selection_notice",
      "url": "https://bksy.cug.edu.cn/info/1463/24294.htm",
      "published_at": null,
      "evidence": "2026年秋季本科生选课通知；用于目标学期背景，不替代培养方案。"
    }
  ],
  "known_registry_issues": [
    {
      "id": "special-unit-not-home-major",
      "severity": "warning",
      "detail": "李四光学院、未来技术学院和安哈尔特学院记录不得覆盖学籍学院/专业；必须先确认班型或项目身份。"
    }
  ],
  "sources": [
    {
      "id": "dxy:070901:ordinary",
      "college_id": "dxy",
      "college_name": "地球与行星科学学院",
      "major": "地质学",
      "major_code": "070901",
      "variant": null,
      "cooperative": false,
      "catalog_current_2026": true,
      "first_enrollment_year": null,
      "landing_url": "https://dxy.cug.edu.cn/info/1021/4217.htm",
      "direct_url": null,
      "published_at": "2024-04-19",
      "applicable_cohorts": {
        "from": 2023,
        "through": null,
        "explicit": false
      },
      "access_level": "B",
      "access_mode": "captcha/upload_required",
      "status": "FOUND_UNPARSED",
      "retrieved_at": "2026-08-23",
      "evidence": "学院官方页面列出地质学专业2023版培养方案附件；附件下载受验证码保护，未读取正文。",
      "evidence_urls": [],
      "notes": "仅能在用户或管理员上传对应附件后解析；不得套用于其他专业。"
    },
    {
      "id": "dxy:070901:国家理科基地班",
      "college_id": "dxy",
      "college_name": "地球与行星科学学院",
      "major": "地质学",
      "major_code": "070901",
      "variant": "国家理科基地班",
      "cooperative": false,
      "catalog_current_2026": true,
      "first_enrollment_year": null,
      "landing_url": "https://dxy.cug.edu.cn/info/1021/4217.htm",
      "direct_url": null,
      "published_at": "2024-04-19",
      "applicable_cohorts": {
        "from": 2023,
        "through": null,
        "explicit": false
      },
      "access_level": "B",
      "access_mode": "captcha/upload_required",
      "status": "FOUND_UNPARSED",
      "retrieved_at": "2026-08-23",
      "evidence": "学院官方页面列出地质学专业2023版培养方案附件；附件下载受验证码保护，未读取正文。",
      "evidence_urls": [],
      "notes": "仅能在用户或管理员上传对应附件后解析；不得套用于其他专业。"
    },
    {
      "id": "dxy:070901:珠峰班",
      "college_id": "dxy",
      "college_name": "地球与行星科学学院",
      "major": "地质学",
      "major_code": "070901",
      "variant": "珠峰班",
      "cooperative": false,
      "catalog_current_2026": true,
      "first_enrollment_year": null,
      "landing_url": "https://dxy.cug.edu.cn/info/1021/4217.htm",
      "direct_url": null,
      "published_at": "2024-04-19",
      "applicable_cohorts": {
        "from": 2023,
        "through": null,
        "explicit": false
      },
      "access_level": "B",
      "access_mode": "captcha/upload_required",
      "status": "FOUND_UNPARSED",
      "retrieved_at": "2026-08-23",
      "evidence": "学院官方页面列出地质学专业2023版培养方案附件；附件下载受验证码保护，未读取正文。",
      "evidence_urls": [],
      "notes": "仅能在用户或管理员上传对应附件后解析；不得套用于其他专业。"
    },
    {
      "id": "dxy:070902:ordinary",
      "college_id": "dxy",
      "college_name": "地球与行星科学学院",
      "major": "地球化学",
      "major_code": "070902",
      "variant": null,
      "cooperative": false,
      "catalog_current_2026": true,
      "first_enrollment_year": null,
      "landing_url": "https://www.cug.edu.cn/xkjs1/bkzysz.htm",
      "direct_url": null,
      "published_at": null,
      "applicable_cohorts": {
        "from": null,
        "through": null,
        "explicit": false
      },
      "access_level": "D",
      "access_mode": "not_found/manual_only",
      "status": "MISSING",
      "retrieved_at": "2026-08-23",
      "evidence": "学校2026年本科招生专业目录确认专业存在；截至检索日未找到当前完整、可核验的学期课程表。",
      "evidence_urls": [],
      "notes": "只能手动输入；不得以地质学或李四光学院菁英班方案替代。"
    },
    {
      "id": "dxy:070804TK:ordinary",
      "college_id": "dxy",
      "college_name": "地球与行星科学学院",
      "major": "行星科学",
      "major_code": "070804TK",
      "variant": null,
      "cooperative": false,
      "catalog_current_2026": true,
      "first_enrollment_year": 2026,
      "landing_url": "https://dxy.cug.edu.cn/info/1034/8166.htm",
      "direct_url": null,
      "published_at": "2026-04-03",
      "applicable_cohorts": {
        "from": 2026,
        "through": null,
        "explicit": true
      },
      "access_level": "D",
      "access_mode": "not_found/manual_only",
      "status": "MISSING",
      "retrieved_at": "2026-08-23",
      "evidence": "学院发布培养方案论证/评审新闻，学校公告确认2026年首次招生；未发现最终学期课程表。",
      "evidence_urls": [
        "https://www.cug.edu.cn/info/10506/119113.htm"
      ],
      "notes": "2026级新专业；论证新闻不能作为可导入方案。"
    },
    {
      "id": "zyxy:081403K:ordinary",
      "college_id": "zyxy",
      "college_name": "资源学院",
      "major": "资源勘查工程",
      "major_code": "081403K",
      "variant": null,
      "cooperative": false,
      "catalog_current_2026": true,
      "first_enrollment_year": null,
      "landing_url": "https://zyxy.cug.edu.cn/info/1030/19849.htm",
      "direct_url": null,
      "published_at": "2026-08-16",
      "applicable_cohorts": {
        "from": 2023,
        "through": null,
        "explicit": true
      },
      "access_level": "B",
      "access_mode": "captcha/upload_required",
      "status": "FOUND_UNPARSED",
      "retrieved_at": "2026-08-23",
      "evidence": "学院官方页面列出2023版附件并明确从2023级开始使用；附件下载受验证码保护。",
      "evidence_urls": [],
      "notes": "上传与专业/班型完全匹配的原PDF后方可启用。"
    },
    {
      "id": "zyxy:081403K:紫金地矿班",
      "college_id": "zyxy",
      "college_name": "资源学院",
      "major": "资源勘查工程",
      "major_code": "081403K",
      "variant": "紫金地矿班",
      "cooperative": false,
      "catalog_current_2026": true,
      "first_enrollment_year": null,
      "landing_url": "https://zyxy.cug.edu.cn/info/1030/19849.htm",
      "direct_url": null,
      "published_at": "2026-08-16",
      "applicable_cohorts": {
        "from": 2023,
        "through": null,
        "explicit": true
      },
      "access_level": "B",
      "access_mode": "captcha/upload_required",
      "status": "FOUND_UNPARSED",
      "retrieved_at": "2026-08-23",
      "evidence": "学院官方页面列出2023版附件并明确从2023级开始使用；附件下载受验证码保护。",
      "evidence_urls": [],
      "notes": "上传与专业/班型完全匹配的原PDF后方可启用。"
    },
    {
      "id": "zyxy:081502:ordinary",
      "college_id": "zyxy",
      "college_name": "资源学院",
      "major": "石油工程",
      "major_code": "081502",
      "variant": null,
      "cooperative": false,
      "catalog_current_2026": true,
      "first_enrollment_year": null,
      "landing_url": "https://zyxy.cug.edu.cn/info/1030/19849.htm",
      "direct_url": null,
      "published_at": "2026-08-16",
      "applicable_cohorts": {
        "from": 2023,
        "through": null,
        "explicit": true
      },
      "access_level": "B",
      "access_mode": "captcha/upload_required",
      "status": "FOUND_UNPARSED",
      "retrieved_at": "2026-08-23",
      "evidence": "学院官方页面列出2023版附件并明确从2023级开始使用；附件下载受验证码保护。",
      "evidence_urls": [],
      "notes": "上传与专业/班型完全匹配的原PDF后方可启用。"
    },
    {
      "id": "zyxy:081407T:ordinary",
      "college_id": "zyxy",
      "college_name": "资源学院",
      "major": "资源环境大数据工程",
      "major_code": "081407T",
      "variant": null,
      "cooperative": false,
      "catalog_current_2026": true,
      "first_enrollment_year": null,
      "landing_url": "https://zyxy.cug.edu.cn/info/1030/19849.htm",
      "direct_url": null,
      "published_at": "2026-08-16",
      "applicable_cohorts": {
        "from": 2023,
        "through": null,
        "explicit": true
      },
      "access_level": "B",
      "access_mode": "captcha/upload_required",
      "status": "FOUND_UNPARSED",
      "retrieved_at": "2026-08-23",
      "evidence": "学院官方页面列出2023版附件并明确从2023级开始使用；附件下载受验证码保护。",
      "evidence_urls": [],
      "notes": "上传与专业/班型完全匹配的原PDF后方可启用。"
    },
    {
      "id": "chxy:080403:ordinary",
      "college_id": "chxy",
      "college_name": "材料与化学学院",
      "major": "材料化学",
      "major_code": "080403",